{
  "DirectoryId": "example-5111",
  "Name": "example-6497",
  "ShortName": "example-4615",
  "Size": "example-1491",
  "Edition": "example-2541",
  "Alias": "example-7135",
  "AccessUrl": "example-2096",
  "Description": "example-3861",
  "DnsIpAddrs": "example-8015",
  "Stage": "example-7615",
  "ShareStatus": "example-5031",
  "ShareMethod": "example-7123",
  "ShareNotes": "example-2693",
  "LaunchTime": "example-4520",
  "StageLastUpdatedDateTime": "example-4649",
  "Type": "example-7148",
  "VpcSettings": "example-6424",
  "ConnectSettings": "example-1468",
  "RadiusSettings": "example-4733",
  "RadiusStatus": "example-9805",
  "StageReason": "example-2106",
  "SsoEnabled": "example-8882",
  "DesiredNumberOfDomainControllers": "example-1583",
  "OwnerDirectoryDescription": "example-1392",
  "RegionsInfo": "example-7819",
  "OsVersion": "example-7522"
}